{
  "edition": "PROMPT-FULL",
  "revision": "2.0",
  "harness": "standard",
  "channel": "Teams",
  "tenantId": null,
  "environmentId": null,
  "region": null,
  "models": {
    "author": "GPT-5.5 (user-reported selector; verify exact label)",
    "checker": "GPT-5.5 (separate configured context)",
    "optionalAuthor": "Claude Sonnet 4.6",
    "otherUserReportedLabels": [
      "gpt 5",
      "5.6",
      "Claude Sonnet 5",
      "opus 4.8",
      "opus 5"
    ]
  },
  "knowledgeMode": "manual_scoped_upload_optional",
  "sharePointRequired": false,
  "customApiRequired": false,
  "mcpRequired": false,
  "transportProfile": "none",
  "caseStore": "operator_saved_case_folder",
  "automaticWriteBack": false,
  "mcpUrl": null,
  "apiUrl": null,
  "connectionReference": null,
  "trustedEnvelopeProvider": null,
  "sourceCloudApproval": "not_configured",
  "modelAvailability": "user_reported_not_tenant_probed"
}
